{
  "$schema": "http://json-schema.org/draft-07/schema#",
  "$ref": "#/definitions/SalesOrderDetail",
  "definitions": {
    "SalesOrderDetail": {
      "type": "object",
      "additionalProperties": true,
      "required": [
        "name",
        "requestedStartDate",
        "salesOrderStatus",
        "id",
        "orderNumber",
        "salesOrderConfirmationStatus",
        "salesOrderType",
        "confirmationRecipientEmailText",
        "description",
        "developerStatusCode"
      ],
      "properties": {
        "auditDetail": {
          "description": "Defines standard system audit fields available for most types",
          "example": {
            "createdOn": "2021-01-21T21:21:21Z",
            "createdBy": "0054x000002IpBlAAK",
            "updatedOn": "2021-01-21T21:21:21Z",
            "updatedBy": "0054x000002xBGGAA2",
            "isDeleted": false
          },
          "type": "object",
          "additionalProperties": true,
          "required": [
            "createdOn",
            "createdBy",
            "updatedOn",
            "updatedBy",
            "isDeleted"
          ],
          "properties": {
            "createdOn": {
              "type": "string",
              "format": "date-time"
            },
            "createdBy": {
              "type": "string"
            },
            "updatedOn": {
              "type": "string",
              "format": "date-time"
            },
            "updatedBy": {
              "type": "string"
            },
            "isDeleted": {
              "type": "boolean"
            }
          }
        },
        "id": {
          "anyOf": [
            {
              "type": "string"
            },
            {
              "type": "null"
            }
          ]
        },
        "name": {
          "type": "string"
        },
        "totalPendingBillingAmount": {
          "anyOf": [
            {
              "type": "integer"
            },
            {
              "type": "null"
            }
          ]
        },
        "checkoutDate": {
          "anyOf": [
            {
              "type": "string",
              "format": "date"
            },
            {
              "type": "null"
            }
          ]
        },
        "priceCalculationStatusMessageText": {
          "type": "string"
        },
        "confirmationRecipientEmailText": {
          "type": "string"
        },
        "orderEndDate": {
          "anyOf": [
            {
              "type": "string",
              "format": "date"
            },
            {
              "type": "null"
            }
          ]
        },
        "isTaxExempt": {
          "anyOf": [
            {
              "type": "boolean"
            },
            {
              "type": "null"
            }
          ]
        },
        "totalProductTaxAmount": {
          "anyOf": [
            {
              "type": "integer"
            },
            {
              "type": "null"
            }
          ]
        },
        "isAlerted": {
          "anyOf": [
            {
              "type": "boolean"
            },
            {
              "type": "null"
            }
          ]
        },
        "isAnonymous": {
          "anyOf": [
            {
              "type": "boolean"
            },
            {
              "type": "null"
            }
          ]
        },
        "description": {
          "type": "string"
        },
        "activatedDate": {
          "anyOf": [
            {
              "type": "string",
              "format": "date"
            },
            {
              "type": "null"
            }
          ]
        },
        "billToEmail": {
          "type": "array",
          "items": {
            "type": "string"
          }
        },
        "requestedStartDate": {
          "type": "string",
          "format": "date"
        },
        "companyAuthorizedDate": {
          "anyOf": [
            {
              "type": "string",
              "format": "date"
            },
            {
              "type": "null"
            }
          ]
        },
        "orderInsuranceAmount": {
          "anyOf": [
            {
              "type": "integer"
            },
            {
              "type": "null"
            }
          ]
        },
        "isClosed": {
          "anyOf": [
            {
              "type": "boolean"
            },
            {
              "type": "null"
            }
          ]
        },
        "shipToEmail": {
          "type": "array",
          "items": {
            "type": "string"
          }
        },
        "totalDeliveryAmount": {
          "anyOf": [
            {
              "type": "integer"
            },
            {
              "type": "null"
            }
          ]
        },
        "salesOrderConfirmationStatus": {
          "type": "array",
          "items": {
            "type": "object",
            "additionalProperties": true,
            "required": [
              "id",
              "name"
            ],
            "properties": {
              "id": {
                "anyOf": [
                  {
                    "type": "string"
                  },
                  {
                    "type": "null"
                  }
                ]
              },
              "name": {
                "type": "string"
              }
            }
          }
        },
        "salesOrderType": {
          "type": "array",
          "items": {
            "type": "object",
            "additionalProperties": true,
            "required": [
              "id",
              "name"
            ],
            "properties": {
              "id": {
                "anyOf": [
                  {
                    "type": "string"
                  },
                  {
                    "type": "null"
                  }
                ]
              },
              "name": {
                "type": "string"
              }
            }
          }
        },
        "customerAuthorizedDate": {
          "anyOf": [
            {
              "type": "string",
              "format": "date"
            },
            {
              "type": "null"
            }
          ]
        },
        "totalCancelledBillingAmount": {
          "anyOf": [
            {
              "type": "integer"
            },
            {
              "type": "null"
            }
          ]
        },
        "totalAdjustedDeliveryTaxAmount": {
          "anyOf": [
            {
              "type": "integer"
            },
            {
              "type": "null"
            }
          ]
        },
        "paymentMethod": {
          "type": "array",
          "items": {
            "type": "string"
          }
        },
        "totalAdjustmentAmount": {
          "anyOf": [
            {
              "type": "integer"
            },
            {
              "type": "null"
            }
          ]
        },
        "salesOrderStatus": {
          "type": "array",
          "items": {
            "type": "object",
            "additionalProperties": true,
            "required": [
              "id",
              "name"
            ],
            "properties": {
              "id": {
                "anyOf": [
                  {
                    "type": "string"
                  },
                  {
                    "type": "null"
                  }
                ]
              },
              "name": {
                "type": "string"
              }
            }
          }
        },
        "renewalUpliftRate": {
          "anyOf": [
            {
              "type": "integer"
            },
            {
              "type": "null"
            }
          ]
        },
        "totalProductAmount": {
          "anyOf": [
            {
              "type": "integer"
            },
            {
              "type": "null"
            }
          ]
        },
        "renewalTerm": {
          "type": "array",
          "items": {
            "type": "object",
            "additionalProperties": true,
            "required": [
              "id",
              "name"
            ],
            "properties": {
              "id": {
                "anyOf": [
                  {
                    "type": "string"
                  },
                  {
                    "type": "null"
                  }
                ]
              },
              "name": {
                "type": "string"
              }
            }
          }
        },
        "originalOrder": {
          "type": "array",
          "items": {
            "type": "string"
          }
        },
        "billToAccount": {
          "type": "array",
          "items": {
            "type": "string"
          }
        },
        "totalAdjustmentTaxAmount": {
          "anyOf": [
            {
              "type": "integer"
            },
            {
              "type": "null"
            }
          ]
        },
        "isGiftOrder": {
          "anyOf": [
            {
              "type": "boolean"
            },
            {
              "type": "null"
            }
          ]
        },
        "promiseFulfillmentDate": {
          "anyOf": [
            {
              "type": "string",
              "format": "date"
            },
            {
              "type": "null"
            }
          ]
        },
        "filedDate": {
          "anyOf": [
            {
              "type": "string",
              "format": "date"
            },
            {
              "type": "null"
            }
          ]
        },
        "iSOCulture": {
          "type": "string"
        },
        "userDeviceSession": {
          "type": "array",
          "items": {
            "type": "object",
            "additionalProperties": true,
            "required": [
              "id",
              "name"
            ],
            "properties": {
              "id": {
                "anyOf": [
                  {
                    "type": "string"
                  },
                  {
                    "type": "null"
                  }
                ]
              },
              "name": {
                "type": "string"
              }
            }
          }
        },
        "purchaseOrderNumber": {
          "type": "string"
        },
        "totalDeliveryFeeAmount": {
          "anyOf": [
            {
              "type": "integer"
            },
            {
              "type": "null"
            }
          ]
        },
        "totalDeliveryTaxAmount": {
          "anyOf": [
            {
              "type": "integer"
            },
            {
              "type": "null"
            }
          ]
        },
        "totalTaxAmount": {
          "anyOf": [
            {
              "type": "integer"
            },
            {
              "type": "null"
            }
          ]
        },
        "orderNumber": {
          "type": "string"
        },
        "seller": {
          "type": "array",
          "items": {
            "type": "string"
          }
        },
        "billToAddress": {
          "type": "array",
          "items": {
            "type": "string"
          }
        },
        "shipToAddress": {
          "type": "array",
          "items": {
            "type": "string"
          }
        },
        "fulfilledDate": {
          "anyOf": [
            {
              "type": "string",
              "format": "date"
            },
            {
              "type": "null"
            }
          ]
        },
        "billToContact": {
          "type": "array",
          "items": {
            "type": "string"
          }
        },
        "paidDate": {
          "anyOf": [
            {
              "type": "string",
              "format": "date"
            },
            {
              "type": "null"
            }
          ]
        },
        "totalBookingAmount": {
          "anyOf": [
            {
              "type": "integer"
            },
            {
              "type": "null"
            }
          ]
        },
        "adjustedProductTaxAmount": {
          "anyOf": [
            {
              "type": "integer"
            },
            {
              "type": "null"
            }
          ]
        },
        "promiseDate": {
          "anyOf": [
            {
              "type": "string",
              "format": "date"
            },
            {
              "type": "null"
            }
          ]
        },
        "packedDate": {
          "anyOf": [
            {
              "type": "string",
              "format": "date"
            },
            {
              "type": "null"
            }
          ]
        },
        "isHistoricalOnly": {
          "anyOf": [
            {
              "type": "boolean"
            },
            {
              "type": "null"
            }
          ]
        },
        "grandTotalAmount": {
          "anyOf": [
            {
              "type": "integer"
            },
            {
              "type": "null"
            }
          ]
        },
        "isContracted": {
          "anyOf": [
            {
              "type": "boolean"
            },
            {
              "type": "null"
            }
          ]
        },
        "canBillNow": {
          "anyOf": [
            {
              "type": "boolean"
            },
            {
              "type": "null"
            }
          ]
        },
        "adjustedTotalProductAmount": {
          "anyOf": [
            {
              "type": "integer"
            },
            {
              "type": "null"
            }
          ]
        },
        "orderDiscount": {
          "anyOf": [
            {
              "type": "integer"
            },
            {
              "type": "null"
            }
          ]
        },
        "internalBusinessUnit": {
          "type": "array",
          "items": {
            "type": "string"
          }
        },
        "salesChannel": {
          "type": "array",
          "items": {
            "type": "string"
          }
        },
        "orderStartDate": {
          "anyOf": [
            {
              "type": "string",
              "format": "date"
            },
            {
              "type": "null"
            }
          ]
        },
        "cancelDateType": {
          "type": "string"
        },
        "isReductionOrder": {
          "anyOf": [
            {
              "type": "boolean"
            },
            {
              "type": "null"
            }
          ]
        },
        "salesOrderSystemStatus": {
          "type": "string"
        },
        "isSuspended": {
          "anyOf": [
            {
              "type": "boolean"
            },
            {
              "type": "null"
            }
          ]
        },
        "billToPhoneNumber": {
          "type": "array",
          "items": {
            "type": "string"
          }
        },
        "purchaseOrderDate": {
          "anyOf": [
            {
              "type": "string",
              "format": "date"
            },
            {
              "type": "null"
            }
          ]
        },
        "soldToCustomer": {
          "type": "array",
          "items": {
            "type": "string"
          }
        },
        "billingDayOfTheMonth": {
          "anyOf": [
            {
              "type": "integer"
            },
            {
              "type": "null"
            }
          ]
        },
        "cancelDate": {
          "anyOf": [
            {
              "type": "string",
              "format": "date"
            },
            {
              "type": "null"
            }
          ]
        },
        "shipToContact": {
          "type": "array",
          "items": {
            "type": "string"
          }
        },
        "taxRate": {
          "anyOf": [
            {
              "type": "integer"
            },
            {
              "type": "null"
            }
          ]
        },
        "developerStatusCode": {
          "type": "string"
        }
      }
    }
  }
}
